{
  "$schema": "https://json-schema.org/draft/2020-12/schema",
  "$id": "https://contracts.baobab-platform.com/trade/v2/buyer-execution-context.schema.json",
  "title": "Trade buyer execution context and buyer operation decision",
  "description": "ADR-SHARED-042 section 7 (work package CAA-01): the derived, purpose-bound Trade execution object Trade assembles server-side from independently verified facts. The chain is: IAM-verified human, then the CP canonical Principal and ACTIVE ExternalIdentity, then an expressly selected, CP-attested canonical buyer Organisation, then the Trade BuyerOrganisation and current BuyerMembership, then the current operation policy, then the independent CP context and seller authority. It is not a global identity, not a CP PlatformContext, not a credential and not perpetual authority. No browser, client, Medusa customer JWT or background job may submit it as a source of truth. Buyer ALLOW alone never executes a transaction: consequential execution also requires the seller decision (trade/v2 order-authority) and a native execution fence. This contract registers no route, capability or grant.",
  "$defs": {
    "actorType": {
      "const": "HUMAN",
      "description": "Only human actors are defined in this version. Machine procurement (registered WORKLOAD Principals with an explicit Organisation mandate, ADR-SHARED-042 section 8) needs its own versioned delegation profile before activation and is refused here."
    },
    "buyerOperation": {
      "type": "string",
      "description": "The exact buyer-side operation evaluated. Seller-side consequential classes remain trade/v2 order-operations.yaml; trade.order.commit and trade.draft-order.finalize appear in both because each needs both decisions.",
      "enum": [
        "trade.buyer-context.resolve",
        "trade.private-catalogue.view",
        "trade.contract-price.view",
        "trade.rfq.submit",
        "trade.quotation.accept",
        "trade.cart.modify",
        "trade.purchase-approval.decide",
        "trade.order.commit",
        "trade.draft-order.finalize",
        "trade.buyer-invitation.accept",
        "trade.buyer-member.manage"
      ]
    },
    "decisionOutcome": {
      "type": "string",
      "description": "ALLOW is the only outcome that can contribute to execution, and only together with the seller decision. APPROVAL_REQUIRED is not executable purchase permission. SELECTION_REQUIRED means no acting Organisation was selected. UNAVAILABLE is retryable and never softened to success.",
      "enum": ["ALLOW", "APPROVAL_REQUIRED", "SELECTION_REQUIRED", "DENY", "UNAVAILABLE"]
    },
    "decisionReason": {
      "type": "string",
      "description": "Closed reasons. Reasons for an Organisation the actor cannot act for are never more specific than BUYER_NOT_AUTHORISED, so no foreign record can be probed.",
      "enum": [
        "BUYER_TOKEN_INVALID",
        "ASSURANCE_INSUFFICIENT",
        "IDENTITY_NOT_RESOLVED",
        "PRINCIPAL_NOT_ACTIVE",
        "ORGANISATION_SELECTION_REQUIRED",
        "BUYER_NOT_AUTHORISED",
        "ORGANISATION_NOT_ATTESTED",
        "BUYER_ACCOUNT_NOT_ACTIVE",
        "ROLE_NOT_PERMITTED",
        "SITE_NOT_PERMITTED",
        "MARKET_NOT_PERMITTED",
        "PURCHASE_ORDER_REQUIRED",
        "SPEND_LIMIT_EXCEEDED",
        "APPROVAL_THRESHOLD_EXCEEDED",
        "SEPARATION_OF_DUTIES",
        "TRANSACTION_CHANGED",
        "CONTEXT_NOT_USABLE",
        "SELLER_AUTHORITY_ABSENT",
        "OPERATION_NOT_ACTIVATED",
        "SOURCE_UNAVAILABLE"
      ]
    },
    "transactionDigest": {
      "type": "string",
      "pattern": "^sha256:[0-9a-f]{64}$",
      "description": "Digest over the immutable commercial facts of the exact resource version (lines, quantities, prices, currency, tax, Incoterm, parties). Any material change invalidates the decision and its approvals."
    },
    "evidenceReference": {
      "type": "string",
      "minLength": 1,
      "maxLength": 500,
      "description": "Redacted upstream provenance (for example a CP decision or attestation id). Never a token, credential or unnecessary personal data."
    },
    "BuyerOperationDecision": {
      "type": "object",
      "additionalProperties": false,
      "required": ["outcome", "reasons"],
      "properties": {
        "outcome": { "$ref": "#/$defs/decisionOutcome" },
        "reasons": {
          "type": "array",
          "uniqueItems": true,
          "maxItems": 20,
          "items": { "$ref": "#/$defs/decisionReason" },
          "description": "Empty only for ALLOW."
        }
      },
      "allOf": [
        {
          "if": { "properties": { "outcome": { "const": "ALLOW" } } },
          "then": { "properties": { "reasons": { "maxItems": 0 } } },
          "else": { "properties": { "reasons": { "minItems": 1 } } }
        }
      ]
    },
    "TradeBuyerExecutionContext": {
      "type": "object",
      "additionalProperties": false,
      "required": [
        "context_id",
        "decision_id",
        "correlation_id",
        "actor_type",
        "actor_principal_id",
        "external_identity_id",
        "tenant_id",
        "digital_estate_id",
        "engine_instance_id",
        "canonical_organisation_id",
        "buyer_organisation_id",
        "buyer_membership_id",
        "membership_revision",
        "cp_context_id",
        "operation",
        "policy_revision",
        "decision",
        "evaluated_at",
        "expires_at",
        "evidence_references"
      ],
      "properties": {
        "context_id": { "type": "string", "format": "uuid", "description": "This Trade context. Distinct from cp_context_id." },
        "decision_id": { "type": "string", "format": "uuid" },
        "correlation_id": { "type": "string", "format": "uuid" },
        "actor_type": { "$ref": "#/$defs/actorType" },
        "actor_principal_id": {
          "type": "string",
          "format": "uuid",
          "description": "The CP canonical human Principal resolved from verified subject evidence (identity/v1 principal-resolution). Never a Medusa customer, email or a value a caller supplied."
        },
        "external_identity_id": { "type": "string", "format": "uuid", "description": "The ACTIVE ExternalIdentity the Principal was resolved through." },
        "tenant_id": { "$ref": "../../control-plane/v1/domain.schema.json#/$defs/tenantId", "description": "The seller-side trading Tenant, from Trade's own CP context; never inferred from a browser header or the buyer." },
        "digital_estate_id": { "$ref": "../../control-plane/v1/domain.schema.json#/$defs/estateId" },
        "market_id": { "$ref": "../../control-plane/v1/domain.schema.json#/$defs/resourceId", "description": "Required for pricing, cart, RFQ, quotation, approval and order operations; resolved through CP market participation, never trusted as requested." },
        "engine_instance_id": { "$ref": "../../control-plane/v1/domain.schema.json#/$defs/engineInstanceId" },
        "canonical_organisation_id": { "$ref": "../../organisation/v2/domain.schema.json#/$defs/organisationId", "description": "Expressly selected by the actor and attested by CP for the seller-side Tenant. Never the Tenant's own PRIMARY Organisation by default." },
        "buyer_organisation_id": { "$ref": "../../buyer-organisation/v1/domain.schema.json#/$defs/buyerOrganisationId" },
        "buyer_membership_id": { "$ref": "../../buyer-organisation/v1/domain.schema.json#/$defs/buyerMembershipId" },
        "membership_revision": { "type": "integer", "minimum": 1, "description": "The membership version evaluated; a later revision invalidates this context." },
        "roles": {
          "type": "array",
          "uniqueItems": true,
          "items": { "$ref": "../../buyer-organisation/v1/domain.schema.json#/$defs/buyerRole" },
          "description": "Inputs to the operation policy, never universal permission or platform grants."
        },
        "seller_legal_entity_id": { "$ref": "../../control-plane/v1/domain.schema.json#/$defs/canonicalLegalEntityId" },
        "seller_binding_reference": { "$ref": "seller-operating-binding.schema.json#/$defs/bindingReference" },
        "cp_context_id": { "type": "string", "format": "uuid", "description": "Trade's own bounded RUNTIME CP context. Its workload Principal is never the buyer." },
        "capability_decision_reference": { "$ref": "#/$defs/evidenceReference" },
        "operation": { "$ref": "#/$defs/buyerOperation" },
        "resource_id": { "type": "string", "minLength": 1, "maxLength": 128 },
        "resource_version": { "type": "integer", "minimum": 1 },
        "transaction_digest": { "$ref": "#/$defs/transactionDigest" },
        "amount_minor": { "type": "integer", "minimum": 0 },
        "currency": { "type": "string", "pattern": "^[A-Z]{3}$" },
        "policy_revision": { "type": "string", "minLength": 1, "maxLength": 128 },
        "approval_references": {
          "type": "array",
          "uniqueItems": true,
          "items": { "type": "string", "format": "uuid" },
          "description": "Independent approvals bound to the same Organisation, amount, currency, Market, resource version and digest, each by a Principal distinct from the initiator."
        },
        "decision": { "$ref": "#/$defs/BuyerOperationDecision" },
        "evaluated_at": { "type": "string", "format": "date-time" },
        "expires_at": {
          "type": "string",
          "format": "date-time",
          "description": "At most 60 seconds after evaluated_at and never later than the earliest required evidence (token, CP resolution, CP context). A ceiling, not a grace period for revoked authority."
        },
        "evidence_references": {
          "type": "array",
          "minItems": 1,
          "uniqueItems": true,
          "items": { "$ref": "#/$defs/evidenceReference" }
        }
      },
      "allOf": [
        {
          "description": "Pricing, cart, RFQ, quotation, approval and order operations are scoped to a Market.",
          "if": {
            "properties": {
              "operation": {
                "enum": ["trade.contract-price.view", "trade.rfq.submit", "trade.quotation.accept", "trade.cart.modify", "trade.purchase-approval.decide", "trade.order.commit", "trade.draft-order.finalize"]
              }
            }
          },
          "then": { "required": ["market_id"] }
        },
        {
          "description": "Mutations bind the exact immutable resource version.",
          "if": {
            "properties": {
              "operation": {
                "enum": ["trade.rfq.submit", "trade.quotation.accept", "trade.cart.modify", "trade.purchase-approval.decide", "trade.order.commit", "trade.draft-order.finalize"]
              }
            }
          },
          "then": { "required": ["resource_id", "resource_version", "transaction_digest", "amount_minor", "currency"] }
        },
        {
          "description": "An order commitment also binds the seller of record; buyer ALLOW never substitutes for seller authority.",
          "if": { "properties": { "operation": { "enum": ["trade.order.commit", "trade.draft-order.finalize"] } } },
          "then": { "required": ["seller_legal_entity_id", "seller_binding_reference"] }
        }
      ]
    }
  },
  "$ref": "#/$defs/TradeBuyerExecutionContext"
}
